<?xml version="1.0" encoding="utf-8"?>
<empresa xmlns:xsi="http://www.w3.org/2001/XMLSchema-instance"
 xsi:noNamespaceSchemaLocation="empresa.xsd">
    <pedido>
        <sucursal>
            <codigosucursal>A1111111</codigosucursal>
            <nombretrabajador>Agustin Perez</nombretrabajador>
            <fechapedido>10/02/2023</fechapedido>
            <observacionesucursal>urgente </observacionesucursal>
            <direccion>Moreno de Mora nยบ3</direccion>
        </sucursal>
        <almacen>
            <direccion>Ubrique</direccion>
            <articulos>
                <codigopedido>AAA-111</codigopedido>
                <numerounidades>2</numerounidades>
                <preciounidad>12</preciounidad>
                <observacionesarticulo>Agarre magnetico color amarillo</observacionesarticulo>
                <plazorevision>4</plazorevision>
            </articulos>
        </almacen>
    </pedido>
</empresa>